{"fault_detected":true,"suspect_job":"job_1","suspect_function":"assemble_provenance","explanation":"The upstream provenance table corrupts the demand record identity by writing source_id into the record_id field. The downstream job receives that exact handoff, then prioritizes by looking up ranks by coverage record_id n06-rXX against evidence_sources record_id values s01-s08, so every upstream_rank becomes 0. This violates the requirement to preserve provenance identities and use upstream provenance order. The responsible transformation is supported directly by the upstream assemble_provenance source.","cited_evidence":["pipeline_topology maps job_upstream_demand_provenance to job_1 and job_downstream_coverage_priority to job_2.","The needs handoff is exact: producer_sha256 and consumer_sha256 are both sha256:76c11f98293da434a42b7665d253ed45a2b3c16b6200d3a651d6568db405a6a3.","Job-2 input evidence_sources contains record_id values s01 through s08, while Job-2 input needs contains record_id values n06-r01 through n06-r08.","assemble_provenance source: records.append({'record_id': record.get('source_id', ''), 'source_id': record.get('source_id', ''), 'source_weight': record.get('source_weight', 0), 'rank': index})","prioritize source builds rank_by_record_id from evidence_sources record_id and reads it using coverage record_id: rank_by_record_id.get(coverage.get('record_id', ''), 0).","Observed Job-2 priorities show upstream_rank: 0 for every record, including n06-r01 through n06-r08."],"follow_up_requests":[]}