{"fault_detected":true,"suspect_job":"job_1","suspect_function":"assemble_provenance","explanation":"The two-job execution contains a provenance fault introduced upstream. Job 1 selected and retained all eight demand records, but its assemble_provenance function emits evidence_sources rows with record_id set to the source_id (s01..s08) rather than the retained need record_id (n06-r01..n06-r08). Job 2 received the exact handoff it was given and then could not match evidence_sources record_id values to coverage record_id values, so all upstream_rank values became 0. The visible downstream symptom is incorrect loss of upstream provenance order in priorities, but the responsible transformation is upstream provenance assembly.","cited_evidence":["Job 1 assemble_provenance source appends {'record_id': record.get('source_id', ''), 'source_id': record.get('source_id', ''), 'source_weight': record.get('source_weight', 0), 'rank': index}, replacing the need record identity with the source identity.","Job 2 input evidence_sources contains record_id values s01 through s08 while Job 2 input needs contains record_id values n06-r01 through n06-r08.","Job 2 prioritize builds rank_by_record_id from evidence_sources record_id and then looks it up using coverage record_id; the observed priorities therefore show upstream_rank: 0 for every n06-r## record.","The handoffs show matching producer and consumer hashes for both needs and evidence_sources, so the downstream job consumed the exact upstream artifacts rather than altering the handoff."],"follow_up_requests":[]}