{"fault_detected":true,"suspect_job":"job_1","suspect_function":"assemble_provenance","explanation":"The execution contains a provenance fault introduced upstream. The evidence_sources handoff should let downstream ranking preserve upstream provenance order by demand record identity, but upstream assembled provenance rows with record_id set to source_id values such as s01 instead of need record ids such as n06-r01. Job 2 consumed the exact handed-off artifact and its prioritize function keyed ranks by evidence_sources.record_id, so coverage records n06-r01 through n06-r08 could not match and all upstream_rank values became 0. The responsible localized function is assemble_provenance in job_1.","cited_evidence":["Exact handoff evidence shows evidence_sources was passed unchanged from upstream to downstream: producer_sha256 and consumer_sha256 both sha256:8a65517fc4985942cb1867d67ab450ff9cc4a1de9cb9abf11cff7745c371e17a.","job_1 assemble_provenance source appends {'record_id': record.get('source_id', ''), 'source_id': record.get('source_id', ''), 'source_weight': record.get('source_weight', 0), 'rank': index}, replacing demand record identity with source identity.","Observed job_2 input evidence_sources contains record_id values s01 through s08, while needs and coverage use record_id values n06-r01 through n06-r08.","job_2 prioritize source builds rank_by_record_id from evidence_sources.record_id and looks it up with coverage.record_id; the observed priorities therefore have upstream_rank: 0 for every row."],"follow_up_requests":[]}