{"fault_detected":true,"suspect_job":"job_1","suspect_function":"assemble_provenance","explanation":"The execution contains a fault in upstream provenance ranking. The criteria require demand-descending provenance order, but job_1's assemble_provenance sorts by demand_score ascending, producing ranks n06-r08, n06-r07, ... n06-r01. Job_2 then correctly uses the supplied upstream ranks to put unsupported needs first, so the bad upstream rank makes n06-r07 outrank n06-r01 and drives the wrong recommendation.","cited_evidence":["Behavioural criteria require: preserve deterministic source provenance identities, weights, and demand-descending rank order.","job_1 assemble_provenance source: ordered_rows = sorted(rows, key=lambda record: (record.get('demand_score', 0), record.get('record_id', '')))","job_1 output evidence_sources ranks n06-r08 as rank 1 and n06-r01 as rank 8 despite demand_score values 3 and 9 respectively.","The needs and evidence_sources handoffs have matching producer and consumer hashes, so job_2 consumed the upstream artifacts exactly.","job_2 prioritize source ranks unsupported records using upstream_rank, causing n06-r07 rank 1 and n06-r01 rank 2 in observed priorities."],"follow_up_requests":[]}