{"fault_detected":false,"suspect_job":null,"suspect_function":null,"explanation":"No fault is supported by the supplied evidence. Job 1 selected all eight qualifying demand records from the corpus, preserved the required demand/provenance fields through normalization, and assembled provenance ranks in demand-descending order. The controller-recorded handoffs for both needs and evidence_sources have matching producer and consumer hashes. Job 2 consumed both handoffs, retained the eight allowed record identities, mapped capabilities by exact need text, ranked unsupported needs first while preserving upstream rank order, and recommended the first priority.","cited_evidence":["Top-level corpus contains eight records n06-r01 through n06-r08, all with demand_score >= 3; downstream needs input contains the same eight records with record_id, need, demand_score, source_id, and source_weight preserved.","Handoffs show exact producer/consumer hash matches for needs (sha256:76c11f98293da434a42b7665d253ed45a2b3c16b6200d3a651d6568db405a6a3) and evidence_sources (sha256:bd11ce66923dfad344997d85831de27f1e32e8fd4ad7991761eea8b7dc22878f).","Job 2 output coverage has eight rows for n06-r01 through n06-r08, with direct coverage only where a capability need exactly matches and none for n06-r01 and n06-r07.","Job 2 priorities place unsupported records first: n06-r01 with upstream_rank 1, then n06-r07 with upstream_rank 7, followed by supported records in upstream_rank order 2, 3, 4, 5, 6, 8.","Job 2 recommendation is top_need 'isolate faulty execution branches before replay', matching the first ranked unsupported priority."],"follow_up_requests":[]}